,Title,Jornada,Ciudad,URL,Descripcion,Compañia,Nº Empleados,Rubro,País
29,Senior PHP Developer,Jornada completa,"Managua, Nicaragua",https://ni.linkedin.com/jobs/view/senior-php-developer-at-opticall-bpo-3644101110?refId=PNm6PqXq9LQfGQtx4TkjpA%3D%3D&trackingId=Re%2FYRQHJgRcr1DYTdLVl5w%3D%3D&position=5&pageNum=1&trk=public_jobs_jserp-result_search-card,"Company’s overview:  Opticall BPO was founded in 2016 under one single precept, to become the leading organization in the Business Process Outsourcing Industry. Opticall is rapidly becoming one of the fastest growing BPOs, developing tremendous career opportunities, attractive compensation & benefit packages for our talented members in the countries where it operates. With over +15 support departments such as Marketing, Accounting & Finance, Human Resources, Call Center, IT, Operations and many more, Opticall BPO offers a rewarding work environment, professional development, job stability, and once in a lifetime journey. We are happy to celebrate our success and include you in it. I. Summary/Objective:  The Senior PHP Developer will be responsible for creating web applications that take into consideration all aspects of application development architecture design including – performance, scalability, coding, caching, security, encryption, session state management, error logging and testing. Partner with the Development Team to pilot new Telemedicine features or any other area when required; to include strategy, build out and implementation of the new solutions. Oversee and manage third party developers when needed. Perform ongoing hardware and software maintenance operations, including installing or upgrading hardware or software. Configure servers to meet functional specifications. Establish functional or system standards to address operational requirements, quality requirements, and design constraints. Evaluate existing systems to determine effectiveness and suggest changes to meet organizational requirements. II. Responsibilities:  ● Work with Netbeans, Eclipse, Filezilla, Linux, Windows, Putty, Github, Open SSH, SOAP UI, WinSCP, XAMPP and others ● Investigate system component suitability for specific purposes and make recommendations regarding component use ● Work with OOP, MVC, CMS, Cron Jobs ● Monitor system operation to detect potential problems ● Direct the analysis, development, and operation of complete computer systems ● Other duties may be added and/or assigned as needed ● Unit testing and user case evaluation III. Education and Experience:  ● Software Engineer degree or equivalent ● At least 5 or more years of working experience in the field IV. Skills/ Qualifications: Websocket WebRTC PHP Javascript / jQuery MySQL CSS/HTML5 GIT/Github Redis Ability to communicate technical information, both verbal and written 2 years or more of experience working in a Windows/Mac environment Java or any other desktop/server programming language will be a plus NodeJS knowledge will be a plus Advanced English Level",Opticall BPO,173,Asesoría de externalización y deslocalización,
30,Mid-Level .NET Developer - LATAM,Contrato por obra,"Managua, Managua, Nicaragua",https://ni.linkedin.com/jobs/view/mid-level-net-developer-latam-at-rad-hires-3642272252?refId=PNm6PqXq9LQfGQtx4TkjpA%3D%3D&trackingId=vkcGWA%2B1ju15aVjyeSq0kQ%3D%3D&position=6&pageNum=1&trk=public_jobs_jserp-result_search-card,"We are looking for a Contract Mid-Level .NET Developer to join our team in LATAM. The ideal candidate will have strong programming skills in .NET, C#, and SQL Server. They will also have experience working in a team environment and be able to work independently. The primary responsibility of this position is to develop and maintain .NET applications for our clients. The successful candidate will be able to work on all phases of the development lifecycle, from requirements gathering and analysis to design, implementation, testing, and deployment. They will also be responsible for working with other members of the team to ensure that the applications meet the needs of the business. The ideal candidate will have the following skills and experience: 3+ years of experience in .NET development Strong programming skills in C# Experience with SQL Server Experience working in a team environment Good communication and interpersonal skills Strong spoken and written English speaking skills",,,,
31,Semi Senior Full Stack Developer,Jornada completa,Nicaragua,https://ni.linkedin.com/jobs/view/semi-senior-full-stack-developer-at-launchpad-technologies-inc-3571773898?refId=PNm6PqXq9LQfGQtx4TkjpA%3D%3D&trackingId=eLtvV8lKyTI2rDP%2B43%2F8pA%3D%3D&position=7&pageNum=1&trk=public_jobs_jserp-result_search-card,"Recognized as one of Canada’s fastest-growing companies, Launchpad provides next-generation integration platform capabilities for connecting and managing enterprise automation and data integration. Headquartered in Vancouver, Canada, our operations span both North and South Americas, with a second headquarter located in Santiago, Chile. In 2021, we were recognized as the winner of the BC Tech Associations Technology Impact Awards 'Company of The Year: Growth'. We recognize the global truth that today, every company is a tech company. To succeed, every company everywhere needs their data and workflows to be integrated and automated. That understanding gave us the confidence to compete with our sector's leading providers, win top-level contracts, and build a truly world-class list of clients that includes Walmart, GM, TIME Magazine, Salesforce, Tableau, Splunk, Bolt.com, Freedom House, and more. Our vision is to bring people and technology together to work seamlessly to achieve extraordinary business outcomes and create more efficient societies. If this sounds like something you want to be part of, we’d love to hear from you. What you’ll do: Work in conjunction with other development teams to design and build software products.  Implement approved designs, following industry best practices and with high-quality standards, producing testable results against business requirements.  Support the development and maintenance of project development guidelines, standards and process narratives for in-scope business functions.  Drive and take responsibility for the quality of development and delivery.  Research and assess technology environment and trends for best practices to apply.  Experience & Skills: 2 to 4 years of experience in software and web development.  Java knowledge/experience:  Develop, test and deploy Java-based web and enterprise applications.  Understand and implement design patterns such as MVC and Singleton.  Understand and use advanced features of Java, such as generics and annotations.  Understand and use popular Java frameworks such as Spring, Hibernate, and Struts.  Write and maintain unit tests using JUnit or similar frameworks.  Understand and use application servers such as Tomcat or JBoss.  Understand and use Agile software development methodologies and practices.  Understand and use best practices for performance optimization and scalability.  Good understanding on Spring Boot Auto Configuration, Spring Beans concepts, Spring testing and Spring MVC.  Work in a team environment and participate in code reviews.  Setup projects from scratch with minimal support.  Document code effectively.  Understand and use web services and APIs, such as REST or SOAP.  Understand and use front-end technologies such as JavaScript, HTML, and CSS.  Understand and use messaging systems like ActiveMQ, RabbitMQ or Apache Kafka.  SQL and database management systems experience, be able to understand and create the previous plus Table Design, Foreign keys.  Basic understanding on NoSQL management systems (MongoDB) Understanding and some experience on cloud platforms such as AWS, Azure GCP.  Experience on containers related projects.  Have basic DevOps knowledge and able to make minor changes.  Deployment pipelines experience.  Executes Projects/assignments with minimal supervision and support lower levels Computer Science Degree or similar required.  Desirable Certifications: Oracle Certified Professional, Java SE 8 Programmer.  Strong communication and collaboration skills to partner effectively with teams throughout the organization.  Why work for Launchpad? 100% remote People first culture Excellent compensation in US Dollars Hardware setup for working from home Work with global teams and prominent brands based in North America, Europe, and Asia Training allowances Personal time off (PTO) for vacations, study leave, personal time, etc.  ...and more! At Launchpad, we genuinely care about our people as individuals. If you are looking for a team that values growth, drive, and passion for your craft, if you’re seeking a place to achieve your goals and dreams with fairness and integrity, then you are the future of Launchpad. Launchpad is committed to fostering a diverse and representative workforce and an inclusive work environment where all employees are respected and treated equally. Are you ready to elevate your career at Launchpad? We want to hear your story! Contact us today.",Launchpad Technologies Inc.,51,IT Services and IT Consulting,"Vancouver, British Columbia"
32,Java Developer,Jornada completa,Nicaragua,https://ni.linkedin.com/jobs/view/java-developer-at-launchpad-technologies-inc-3570889228?refId=PNm6PqXq9LQfGQtx4TkjpA%3D%3D&trackingId=zgPTYBhURmcBZi1ZwvFwtg%3D%3D&position=8&pageNum=1&trk=public_jobs_jserp-result_search-card,"Recognized as one of Canada’s fastest-growing companies, Launchpad provides next-generation integration platform capabilities for connecting and managing enterprise automation and data integration. Headquartered in Vancouver, Canada, our operations span both North and South Americas, with a second headquarter located in Santiago, Chile. In 2021, we were recognized as the winner of the BC Tech Associations Technology Impact Awards 'Company of The Year: Growth'. We recognize the global truth that today, every company is a tech company. To succeed, every company everywhere needs their data and workflows to be integrated and automated. That understanding gave us the confidence to compete with our sector's leading providers, win top-level contracts, and build a truly world-class list of clients that includes Walmart, GM, TIME Magazine, Salesforce, Tableau, Splunk, Bolt.com, Freedom House, and more. Our vision is to bring people and technology together to work seamlessly to achieve extraordinary business outcomes and create more efficient societies. If this sounds like something you want to be part of, we’d love to hear from you. You will be responsible for the delivery and support of the enterprise wide OpenText/Documentum Platform product stack. Additionally, this role requires actively working, and aligning solutions, with both IT and non-IT groups throughout. Responsibilities: Support of current Documentum (WebTop, D2) and future Documentum environments will be the primary focus. This includes design, configuration, security management, workflow, development, and other administration tasks enterprise wide.  Providing alternatives and new ideas for requested technical solutions regarding content management.  Ability to consult with personnel at all levels of the organization to discuss business requirements and potential solutions.  Analyze and design functional and non-functional ECM systems software requirements with minimal guidance.  Ability to address and reconcile problems within scope, and timeline.  Assist with the training of users on processes and systems.  Ability to prepare test plans, lead testing efforts and implement defined solutions.  Monitor the performance and utilization of Documentum environment to ensure uptime and performance metrics meet required targets.  Skills: 5+ years administering and developing within Documentum Experience with D2, Brava, Asset Operations (AO), and the Documentum Platform (Content Server, xPlore, etc.).  Track record of developing, and supporting large scale end-to-end OpenText/Documentum solutions Advanced expertise of the OpenText/Documentum technology stack including WebTop, Content Server, Asset Operations, D2, Brava, SmartView, xPlore, and other OpenText applications required to meet business future needs Working knowledge of Windows Server, SQL Server, Active Directory as they pertain to the OpenText/Documentum stack Enterprise environment experience Java development Source Control Content Server, D2, xPlore configurations Why work for Launchpad? 100% remote People first culture Excellent compensation in US Dollars Hardware setup for working from home Work with global teams and prominent brands based in North America, Europe, and Asia Training allowances Personal time off (PTO) for vacations, study leave, personal time, etc.  ...and more! At Launchpad, we genuinely care about our people as individuals. If you are looking for a team that values growth, drive, and passion for your craft, if you’re seeking a place to achieve your goals and dreams with fairness and integrity, then you are the future of Launchpad. Launchpad is committed to fostering a diverse and representative workforce and an inclusive work environment where all employees are respected and treated equally. Are you ready to elevate your career at Launchpad? We want to hear your story! Contact us today.",Launchpad Technologies Inc.,51,IT Services and IT Consulting,"Vancouver, British Columbia"
33,Intermediate Salesforce Developer,Contrato por obra,Nicaragua,https://ni.linkedin.com/jobs/view/intermediate-salesforce-developer-at-launchpad-technologies-inc-3653237388?refId=PNm6PqXq9LQfGQtx4TkjpA%3D%3D&trackingId=7jnkH8aVpzTO9Fh0bhnCvA%3D%3D&position=9&pageNum=1&trk=public_jobs_jserp-result_search-card,"Recognized as one of Canada’s fastest-growing companies, Launchpad provides next-generation integration platform capabilities for connecting and managing enterprise automation and data integration. Headquartered in Vancouver, Canada, our operations span both North and South Americas, with a second headquarter located in Santiago, Chile. In 2021, we were recognized as the winner of the BC Tech Associations Technology Impact Awards 'Company of The Year: Growth'. We recognize the global truth that today, every company is a tech company. To succeed, every company everywhere needs their data and workflows to be integrated and automated. That understanding gave us the confidence to compete with our sector's leading providers, win top-level contracts, and build a truly world-class list of clients that includes Walmart, GM, TIME Magazine, Salesforce, Tableau, Splunk, Bolt.com, Freedom House, and more. Our vision is to bring people and technology together to work seamlessly to achieve extraordinary business outcomes and create more efficient societies. If this sounds like something you want to be part of, we’d love to hear from you. Main Responsibilities: Integrate across systems and present data in the right place at the right time using the tools and platform provided by Salesforce.  Salesforce customization according to any aspect of the business whenever there’s a requirement Provide clients with a solution that will grow with their company and work as they need it to.  What you’ll do: Work closely with Solutions Architect to design Force.com Platform Solutions including, but not limited to, Apex Trigger, Apex Class, Batch Job, Visualforce, Lightning Components Implement Force.com Platform Solutions as per the Industry’s coding convention and best practices Ensure service level availability of the Force.com platform and integration applications and provide on-call support for break/fix/enhancement activities to resolve application issues.  Implement customer-based solutions and develop products on the Force.com platform using Apex and Visual Force Assist with the planning of application changes, development, and installation of upgrades and new releases.  Integrate multiple systems with Salesforce, including internal proprietary and third party applications Lead customer-driven solutions utilizing strong technical design skills and strong working relationships with internal groups Guide users in formulating requirements, advise on alternatives and on the implications of new or revised processing analysis.  Develop, document and enforce application standards and procedures Experience & Skills Computer Science Degree, MIS Degree, or equivalent relevant experience 2-4 years of experience with Salesforce products Understanding of SDLC Certified Salesforce Platform Developer 1 Clear concepts and use of Apex, Visualforce, Lightning Web Components, Declarative Automation, Sales Cloud, understanding of integration concepts, methodologies and technologies Why work for Launchpad? 100% remote People first culture Excellent compensation in US Dollars Hardware setup for working from home Work with global teams and prominent brands based in North America, Europe, and Asia Training allowances Personal time off (PTO) for vacations, study leave, personal time, etc.  ...and more! At Launchpad, we genuinely care about our people as individuals. If you are looking for a team that values growth, drive, and passion for your craft, if you’re seeking a place to achieve your goals and dreams with fairness and integrity, then you are the future of Launchpad. Launchpad is committed to fostering a diverse and representative workforce and an inclusive work environment where all employees are respected and treated equally. Are you ready to elevate your career at Launchpad? We want to hear your story! Contact us today.",Launchpad Technologies Inc.,51,IT Services and IT Consulting,"Vancouver, British Columbia"
34,Senior Full Stack Developer,Jornada completa,Nicaragua,https://ni.linkedin.com/jobs/view/senior-full-stack-developer-at-launchpad-technologies-inc-3626126212?refId=PNm6PqXq9LQfGQtx4TkjpA%3D%3D&trackingId=UPRYZX%2Bb%2FRM0%2BABCZqOf4Q%3D%3D&position=10&pageNum=1&trk=public_jobs_jserp-result_search-card,"Recognized as one of Canada’s fastest-growing companies, Launchpad provides next-generation integration platform capabilities for connecting and managing enterprise automation and data integration. Headquartered in Vancouver, Canada, our operations span both North and South Americas, with a second headquarter located in Santiago, Chile. In 2021, we were recognized as the winner of the BC Tech Associations Technology Impact Awards 'Company of The Year: Growth'. We recognize the global truth that today, every company is a tech company. To succeed, every company everywhere needs their data and workflows to be integrated and automated. That understanding gave us the confidence to compete with our sector's leading providers, win top-level contracts, and build a truly world-class list of clients that includes Walmart, GM, TIME Magazine, Salesforce, Tableau, Splunk, Bolt.com, Freedom House, and more. Our vision is to bring people and technology together to work seamlessly to achieve extraordinary business outcomes and create more efficient societies. If this sounds like something you want to be part of, we’d love to hear from you. We are seeking a highly skilled and experienced Senior Full Stack Developer to join our team. The ideal candidate will have a strong background in building SaaS solutions, with a proven track record of developing high-performing and scalable web applications. Proficiency in React, Node.js, and experience with a cloud provider (ie. AWS, GCP, Azure, etc) is required. Responsibilities of the role: Develop and maintain SaaS applications, from concept to production-ready products, following best practices and coding standards.  Collaborate with cross-functional teams, including product managers, UX/UI designers, and QA testers, to gather requirements and deliver high-quality software solutions.  Write clean, maintainable, and efficient code, ensuring scalability, flexibility, and security of applications.  Optimize web applications for performance, scalability, and usability to ensure the best user experience.  Debug and resolve software defects and production issues in a timely manner.  Skills: Minimum of 5 years of professional experience in building SaaS applications.  Strong proficiency in React, Node.js, and other relevant technologies for building full-stack web applications.  Experience with relational databases (MySQL, Postgres, or something similar) Experience with at least one cloud provider (AWS, GCP, Azure, or something similar) Excellent communication skills and ability to work collaboratively in a team environment.  Demonstrated ability to organize and implement highly scalable and performant web applications.  Strong problem-solving skills and ability to debug and resolve complex software defects.  Familiarity with agile development methodologies and version control systems such as Git.  Bonus: Experience with AWS services (EC2, S3, Lambda, etc) Experience with Angular Experience with C# Experience writing Microsoft Office Add-ins in OfficeJS and/or VSTO Experience with writing Chromium browser extensions using Manifest Version 3 Experience with test automation tools (ie. Selenium, Cypress, Testcafe, or something similar) Experience with Legal Tech Why work for Launchpad? 100% remote People first culture Excellent compensation in US Dollars Hardware setup for working from home Work with global teams and prominent brands based in North America, Europe, and Asia Training allowances Personal time off (PTO) for vacations, study leave, personal time, etc.  ...and more! At Launchpad, we genuinely care about our people as individuals. If you are looking for a team that values growth, drive, and passion for your craft, if you’re seeking a place to achieve your goals and dreams with fairness and integrity, then you are the future of Launchpad. Launchpad is committed to fostering a diverse and representative workforce and an inclusive work environment where all employees are respected and treated equally. Are you ready to elevate your career at Launchpad? We want to hear your story! Contact us today.",Launchpad Technologies Inc.,51,IT Services and IT Consulting,"Vancouver, British Columbia"
