,Title,Jornada,Ciudad,URL,Descripcion,Compañia,Nº Empleados,Rubro,País
15,Data Engineer - Online Job,Jornada completa,"Managua, Managua, Nicaragua",https://ni.linkedin.com/jobs/view/data-engineer-online-job-at-oowlish-3642706670?refId=o%2B22ReeM9cM9LCuy8pCvIQ%3D%3D&trackingId=0KghPQgISIveJOrnRD3s3g%3D%3D&position=16&pageNum=0&trk=public_jobs_jserp-result_search-card,"Be part of our team! 🚀💼 Are you ready to launch your career into the tech stratosphere with one of LatAm's fastest-growing software development companies? 💪💻 At Oowlish, we're on the hunt for tech maestros to join our dynamic, cosmopolitan squad. As an 🦉Oowlish🦉 team member, you won’t just be part of a team, you’ll join an innovative, supportive family, partnering with top-tier clients from the USA and Europe 🌍 to kickstart their digital journey. And being part of a 🌟Great Place to Work🌟, it’s all about learning, growing, and making a global impact - together! Enjoy the flexibility of working in your PJs 🧦, with your furry friend 🐶 on your lap, relishing your freedom and maintaining a perfect work-family life balance ⚖️. Because we know that’s when you’re at your best. If you're a tech enthusiast 🕹️, fluent in English 🗣️, and thrilled about working remotely while making an international splash, then you're on the right page! We are looking for an experienced Data Engineer to join our team and work on international projects. We are looking for people that want to grow, are challenge-driven, follow good practices, and are passionate about technology. Must Haves Fluent in English Bachelor’s degree in Computer Science. 4+ years of experience as a Data Engineer Experience using MongoDB and GraphDB. Experience in building data lakes High-level experience in methodologies and processes for managing large-scale databases. Ability to work with stakeholders to assess potential risks. Ability to analyze existing tools and databases and provide software solution recommendations. Ability to translate business requirements into non-technical, lay terms. Understanding of addressing and metadata standards. Benefits & Perks  Home office 🏠  Flexible Hours;🕜  Competitive compensation based on experience; 💵  Career plans to allow for extensive growth in the company;📈  International Projects;🌍  Oowlish English Program (Improving and Certifying)📚  Spanish Classes 📚  Oowlish fitness with Total Pass;🏋‍♀️  Oowlish Academy (Grants for Education);🎓  Build your Home Office (Grants for Computer & Equipment);💻  Connecting You (Internet allowance);📡  Anniversary bonus;💸  Wedding gift;👰‍♀️  Pet adoption incentive;🐕  New baby Owl bonus;👩‍🍼  Back to School bonus;✏️  Netflix Subscription;📽  Oowlish paradise – 4 days/year at a Resort with your family & pets;🏝  Vacation Bonus;🏖  Games and Competitions;🎮  Enjoy your national Holidays;🎊  Oowlet Store🛒 Come join us in breaking the mold and revolutionizing the tech landscape! 🌐 Remember, with Oowlish, you’re not just getting a job, you’re becoming part of a community 🌍 of innovative, talented, and inspiring individuals who respect each other and our furry friends 🐾. Why wait to make your mark on the tech world? Hit ‘Apply Now’ to embark on Oowlish's exciting journey, and let's turbocharge innovation together! 🚀🎉 You Can Also Apply Here Website: https://www.oowlish.com/work-with-us/ LinkedIn: https://www.linkedin.com/company/oowlish/jobs/ Instagram: https://www.instagram.com/oowlishtechnology/ #amazon #job #home #linkedin #career #online #employment #remote #work # international #clients in united states#clients in USA #vacant #hiring #opportunities #hire #application #apply #virtual #wfh #tech #best #english #online #offer #vacancy#desarrollador #desarrolladora #front end #programador #programadora #programmer #full stack #software engineer #desarrollo #system #developer #application #code #program #desenvolvedor #engineer #engenheiro #sql #sde #web #backend #empleo #trabajo #ofertas #emprego #vagas",Oowlish,124,Serviços e consultoria de TI,"Work from Anywhere, Remote"
16,Test Automation Developer,Jornada completa,Nicaragua,https://ni.linkedin.com/jobs/view/test-automation-developer-at-launchpad-technologies-inc-3608626979?refId=o%2B22ReeM9cM9LCuy8pCvIQ%3D%3D&trackingId=d2qFkiM5lMs37QDz9zCt3Q%3D%3D&position=17&pageNum=0&trk=public_jobs_jserp-result_search-card,"Recognized as one of Canada’s fastest-growing companies, Launchpad provides next-generation integration platform capabilities for connecting and managing enterprise automation and data integration. Headquartered in Vancouver, Canada, our operations span both North and South Americas, with a second headquarter located in Santiago, Chile. In 2021, we were recognized as the winner of the BC Tech Associations Technology Impact Awards 'Company of The Year: Growth'. We recognize the global truth that today, every company is a tech company. To succeed, every company everywhere needs their data and workflows to be integrated and automated. That understanding gave us the confidence to compete with our sector's leading providers, win top-level contracts, and build a truly world-class list of clients that includes Walmart, GM, TIME Magazine, Salesforce, Tableau, Splunk, Bolt.com, Freedom House, and more. Our vision is to bring people and technology together to work seamlessly to achieve extraordinary business outcomes and create more efficient societies. If this sounds like something you want to be part of, we’d love to hear from you. The Test Automation Developer will be responsible for developing and setting up tests and associated tools for verification automation for continuous integration and delivery. You must be able to work with Visual Studio in C# with .Net and Azure Cloud technologies, working in agile environment interacting with the team through tools such as Azure DevOps, Teams, Office 360, Confluence, etc. Responsibilities of the role: Develop and maintain automation of test cases and test tools.  Configure, validate, and support the automation in continuous integration CI.  Act on automation execution results reporting bugs and issues.  Participate in the daily scrum meetings with the Development Team.  Work together with the quality assurance team (QA) Participate actively in the development activities, meetings, knowledge transfer sessions Requirements: 1-2 years of work experience in Testing Automation Knowledge of agile work methodology.  Clear understanding of software testing at unit, component, and system integration levels.  Experience with testing tools, building testing harnesses and developing test automation.  Ability to design, perform and automate the steps required to achieve use cases and related test from defined by QA.  Familiar with integration and continuous delivery (CI/CD) concepts in DevOps (Azure) Cloud (Azure) infrastructure and technology understanding.  Knowledge of virtualization and containers.  We are looking for a professional with experience and knowledge in:  Visual Studio C# with .Net Azure DevOps Azure Cloud RESTful API Web Services RabbitMQ and message queue concepts MSSQL and database querying Why work for Launchpad? 100% remote People first culture Excellent compensation in US Dollars Hardware setup for working from home Work with global teams and prominent brands based in North America, Europe, and Asia Training allowances Personal time off (PTO) for vacations, study leave, personal time, etc.  ...and more! At Launchpad, we genuinely care about our people as individuals. If you are looking for a team that values growth, drive, and passion for your craft, if you’re seeking a place to achieve your goals and dreams with fairness and integrity, then you are the future of Launchpad. Launchpad is committed to fostering a diverse and representative workforce and an inclusive work environment where all employees are respected and treated equally. Are you ready to elevate your career at Launchpad? We want to hear your story! Contact us today.",Launchpad Technologies Inc.,51,IT Services and IT Consulting,"Vancouver, British Columbia"
17,Senior Software Developer,Jornada completa,"Managua, Nicaragua",https://ni.linkedin.com/jobs/view/senior-software-developer-at-now-optics-3599553835?refId=o%2B22ReeM9cM9LCuy8pCvIQ%3D%3D&trackingId=Z8X0hm%2Fal9sh6dUxb6lKyg%3D%3D&position=18&pageNum=0&trk=public_jobs_jserp-result_search-card,"I. Summary/Objective We are looking for a Senior Software Developer to join our IT department and build functional applications and websites. The Senior Software Developer responsibilities include participating in the entire software development life cycle, debugging applications and configuring existing systems. II. Responsibilities  Analyze system requirements and prioritize tasks in agreement with the Application Manager   Write clean, testable code using .NET programming languages (C#), JQuery, SQL, and React   Develop technical specifications and architecture   Test and debug .NET applications   Review and refactor code   Deploy fully functional applications   Upgrade existing programs   Support junior developers’ work   Document development and operational procedures (Flow charts)   Create users cases  III. Education And Experience  BSc in Computer Science, Engineering or relevant field  Work experience in .NET, C#, JQuery, SQL, and React for 5+ years  IV. Skills / Qualifications  Proficiency in building web-based applications   In-depth knowledge of at least one of the .NET languages (like C# and Visual Basic .NET)   Good understanding of Microsoft Azure Fundamentals (Azure Function, Logic Apps & Blob Storage)  Familiarity with agile environments and DevOps   Troubleshooting abilities   Good communication skills   Intermediate English Level",,,,
18,Senior Bubble Developer - LATAM,Contrato por obra,"Managua, Managua, Nicaragua",https://ni.linkedin.com/jobs/view/senior-bubble-developer-latam-at-rad-hires-3641602301?refId=o%2B22ReeM9cM9LCuy8pCvIQ%3D%3D&trackingId=OqYHD8KRp7Rr%2FQF%2FgLDNaQ%3D%3D&position=19&pageNum=0&trk=public_jobs_jserp-result_search-card,"We are looking for a Contract Senior Bubble Developer to join our team in LATAM. The ideal candidate will have experience in Bubble, No-code App Development, and have a strong understanding of web development principles. The role will involve working with our team to design, develop, and launch new Bubble applications for our clients. The successful candidate will be able to work independently and as part of a team, and will have a passion for creating innovative and user-friendly applications. Responsibilities Architect and develop new Bubble applications Work with the clients to launch new applications Provide support to clients for their existing applications Stay up-to-date on the latest Bubble developments Qualifications 3+ years of experience in Bubble development Strong understanding of web development principles Excellent communication and teamwork skills Excellent proficiency in spoken and written English",,,,
19,Software Development Engineer in Test,Jornada completa,Nicaragua,https://ni.linkedin.com/jobs/view/software-development-engineer-in-test-at-launchpad-technologies-inc-3591583979?refId=o%2B22ReeM9cM9LCuy8pCvIQ%3D%3D&trackingId=1Aric0Ogb9XpFxSO41nBfw%3D%3D&position=20&pageNum=0&trk=public_jobs_jserp-result_search-card,"Recognized as one of Canada’s fastest-growing companies, Launchpad provides next-generation integration platform capabilities for connecting and managing enterprise automation and data integration. Headquartered in Vancouver, Canada, our operations span both North and South Americas, with a second headquarter located in Santiago, Chile. In 2021, we were recognized as the winner of the BC Tech Associations Technology Impact Awards 'Company of The Year: Growth'. We recognize the global truth that today, every company is a tech company. To succeed, every company everywhere needs their data and workflows to be integrated and automated. That understanding gave us the confidence to compete with our sector's leading providers, win top-level contracts, and build a truly world-class list of clients that includes Walmart, GM, TIME Magazine, Salesforce, Tableau, Splunk, Bolt.com, Freedom House, and more. Our vision is to bring people and technology together to work seamlessly to achieve extraordinary business outcomes and create more efficient societies. If this sounds like something you want to be part of, we’d love to hear from you. Responsibilities: Define and write test plans and test cases Develop and maintain automated test scripts using Python Conduct hardware in the loop testing and ensure proper functioning of embedded systems Utilize diagnostic tools for Automotive and experience using Vector tools Understand HIL test methods to ensure the correct testing procedures are being used Communicate and document testing procedures and results effectively Requirements: Bachelor's degree in engineering or equivalent real-world experience 4+ years of experience in defining tests and developing test automation 4+ years of experience writing clear Python code for testing automation 4+ years of experience with hardware in the loop testing Familiarity with Embedded Systems Knowledge of CAN and Ethernet buses and diagnostic tools for Automotive Experience using Vector tools Outstanding communication and written skills Bonus: Experience developing in C, C++ GitHub, Git experience Experience with automated test frameworks (e.g., Pytest, Robot Framework), Jira, svn/git, and Continuous Integration systems (e.g., Jenkins, CircleCI) Experience testing medical devices, aviation, automotive, or other safety-critical applications Why work for Launchpad? 100% remote People first culture Excellent compensation in US Dollars Hardware setup for working from home Work with global teams and prominent brands based in North America, Europe, and Asia Training allowances Personal time off (PTO) for vacations, study leave, personal time, etc.  ...and more! At Launchpad, we genuinely care about our people as individuals. If you are looking for a team that values growth, drive, and passion for your craft, if you’re seeking a place to achieve your goals and dreams with fairness and integrity, then you are the future of Launchpad. Launchpad is committed to fostering a diverse and representative workforce and an inclusive work environment where all employees are respected and treated equally. Are you ready to elevate your career at Launchpad? We want to hear your story! Contact us today.",Launchpad Technologies Inc.,51,IT Services and IT Consulting,"Vancouver, British Columbia"
20,Frontend Typescript Developer,Jornada completa,Nicaragua,https://ni.linkedin.com/jobs/view/frontend-typescript-developer-at-philotimo-hr-3656704778?refId=o%2B22ReeM9cM9LCuy8pCvIQ%3D%3D&trackingId=B8dnZc0kZa5YLxGqG1D0yw%3D%3D&position=21&pageNum=0&trk=public_jobs_jserp-result_search-card,"Are you looking to make a difference in how people recover or improve performance? Join UGen, a small but mighty & growing startup in the physical therapy healthcare industry. We are elevating recovery, focusing on large healthcare systems across the US. UGen was born to keep people moving by providing transformational technology for mobility. Patients and athletes utilize our wearable sensor sensors and intelligent analytics engine, guiding them to achieve their best outcomes. The Role Your Responsibilities Will Include Build new dimension wearable sensors and intelligent analytics engines within the physical therapy healthcare industry  Build and maintain user-facing applications elevating data access to empower decisions Application development, including web, mobile, and other containers Design and implement commercial-ready systems Collaborate to achieve results Plan, devise, and implement insightful UI strategies in collaboration with project management, back-end development, and business analytics teams Ideal Profile Who You Are 2-5 years of experience building and delivering customer-facing applications with TypeScript Familiar with current JavaScript and Typescript development principles Strong understanding of browsers and web protocols Comfortable coordinating with remote teams and colleagues Understanding of secure coding standards and practices Naturally curious to explore cutting-edge technologies to stay ahead of the curve Eager to be an integral part of propelling UGen to growth and success Bonus Points Familiarity with hybrid mobile deployments using Capacitor Hands-on experience developing with Angular Experience building Electron based desktop applications Familiarity with AWS components and services Comfortable with DevOps technologies At UGen, we encourage applicants of all backgrounds and identities to apply for roles that align with their interests and career trajectory. If you meet most of the qualifications above and see yourself in this role, we would love to talk to you! UGen provides equal employment opportunities for all applicants and employees. What's on Offer? Work with an inspiring and growing company Directly contribute to commercial products to help people Excellent career development opportunities",,,,
21,Platform Engineer,Jornada completa,Nicaragua,https://ni.linkedin.com/jobs/view/platform-engineer-at-launchpad-technologies-inc-3382800422?refId=o%2B22ReeM9cM9LCuy8pCvIQ%3D%3D&trackingId=9gQWEvhbU534qtk%2FNfiNvQ%3D%3D&position=22&pageNum=0&trk=public_jobs_jserp-result_search-card,"Recognized as one of Canada’s fastest-growing companies, Launchpad provides next-generation integration platform capabilities for connecting and managing enterprise automation and data integration. Headquartered in Vancouver, Canada, our operations span both North and South Americas, with a second headquarter located in Santiago, Chile. In 2021, we were recognized as the winner of the BC Tech Associations Technology Impact Awards 'Company of The Year: Growth'. We recognize the global truth that today, every company is a tech company. To succeed, every company everywhere needs their data and workflows to be integrated and automated. That understanding gave us the confidence to compete with our sector's leading providers, win top-level contracts, and build a truly world-class list of clients that includes Walmart, GM, TIME Magazine, Salesforce, Tableau, Splunk, Bolt.com, Freedom House, and more. Our vision is to bring people and technology together to work seamlessly to achieve extraordinary business outcomes and create more efficient societies. If this sounds like something you want to be part of, we’d love to hear from you. Responsibilities: Configure, deploy and maintain Cloud Infrastructure using Infrastructure as Code (IaC) such as CloudFormation or Terraform Collaborate with your peers as a subject matter expert on Cloud, Release Management, Datacenter Technologies, Automation, Infrastructure as a Service (IaaS), IaC, SysOps, and DevOps Configuration and Management of Linux Servers to run custom-built applications using Configuration Management (CM) tooling such as Ansible or Chef Working knowledge of Networking, and ability to implement secure cloud and hybrid networks.  Cognizance of security best practices Implementation of monitoring for cloud and custom applications Artifact management: manage container images and repositories and validate 3rd party containers Build containerized applications using a certified base Docker image that contains security policies, logging, etc baked in.  Deploy 3rd party containerized applications (SAP, Lucidworks, API gateways, RabbitMQ, etc) Develop, deploy, and monitor serverless computing paradigms such as Lambda, KNative, etc (AWS SAM) Develop automation for IaaS integrations to deploy and manage containerized applications in EKS and ECS Build Serverless Pipelines to augment automation for management of application deployment Work closely with Architects, Developers, Security, and Clients to implement Cloud architecture that spans Serverless, Container, Server, component-based, and Hybrid utilizing industry best practices.  Skills BS degrees in Computer Science or related technical field, or equivalent practical experience.  3+years of experience as a Site Reliability Engineer, Production Engineer or Backend Software Experience with security tooling and best practices for implementation in development pipelines and infrastructure.  Experience with security event management, vulnerability management, intrusion detection, and threat management systems.  Experience with the development and support of major cloud infrastructure and platform services (AWS).  Experience with configuring continuous integration software and code pipelines (Gitlab,Jenkins).  Experience with container and container management, and security scanning technologies (EKS, ECS).  Experience collaborating with customer security teams, auditors, and external securityconsultants.  Experience with configuration management systems for cloud infrastructure and operating systems (Terraform, Ansible).  Demonstrated coding experience with an interpreted programming or scripting language (Python, Bash, PowerShell, JavaScript).  Experience with the Git source control system and ability to assist others in troubleshooting issues.  Experience in working with industry-leading IAM vendor products like SailPoint, Azure AD, Okta etc.  Understanding of Agile software development and management tools (Jira).  Deep hands-on understanding of High Availability, Scalability, Secure Cloud, Disaster Recovery, Release Management as implemented among various architectures eg: Serverless, Container, Server Excellent written and verbal communication skills Experience with Identity and Access Management solutions is nice-to-have Why work for Launchpad? 100% remote People first culture Excellent compensation in US Dollars Hardware setup for working from home Work with global teams and prominent brands based in North America, Europe, and Asia Training allowances Personal time off (PTO) for vacations, study leave, personal time, etc.  ...and more! At Launchpad, we genuinely care about our people as individuals. If you are looking for a team that values growth, drive, and passion for your craft, if you’re seeking a place to achieve your goals and dreams with fairness and integrity, then you are the future of Launchpad. Launchpad is committed to fostering a diverse and representative workforce and an inclusive work environment where all employees are respected and treated equally. Are you ready to elevate your career at Launchpad? We want to hear your story! Contact us today.",Launchpad Technologies Inc.,51,IT Services and IT Consulting,"Vancouver, British Columbia"
